id;uri;siglaTipo;numero;ano;ementa;urlInteiroTeor;Fake_news;OBS
302956;https://dadosabertos.camara.leg.br/api/v2/proposicoes/302956;PL;6035;2005;Estabelece sanções administrativas a hipermercados, supermercados e congêneres que realizem a comercialização de produtos nas condições que especifica.;http://www.camara.gov.br/proposicoesWeb/prop_mostrarintegra?codteor=346640;;
340005;https://dadosabertos.camara.leg.br/api/v2/proposicoes/340005;PL;31;2007;Dispõe sobre o parcelamento do solo para fins urbanos e sobre a regularização fundiária sustentável de áreas urbanas, e dá outras providências.;http://www.camara.gov.br/proposicoesWeb/prop_mostrarintegra?codteor=433779;;
2293346;https://dadosabertos.camara.leg.br/api/v2/proposicoes/2293346;SBT;1;0;"Altera a Lei nº 13.979, de 6 de fevereiro de 2020, que ""dispõe sobre as medidas para enfrentamento da emergência de saúde pública de importância internacional decorrente do coronavírus responsável pelo surto de 2019"", para dispor sobre o registro e a disponibilização de informações de interesse epidemiológico relativas aos pacientes com suspeita ou confirmação de infecção pelo coronavírus atendidos nos serviços de saúde públicos e privados.
Autor: SENADO FEDERAL - PAULO PAIM";http://www.camara.gov.br/proposicoesWeb/prop_mostrarintegra?codteor=2053504;;
2253807;https://dadosabertos.camara.leg.br/api/v2/proposicoes/2253807;PL;2927;2020;Institui a Lei Brasileira de Liberdade, Responsabilidade e Transparência na Internet.;http://www.camara.gov.br/proposicoesWeb/prop_mostrarintegra?codteor=1897975;;
2261031;https://dadosabertos.camara.leg.br/api/v2/proposicoes/2261031;PL;4365;2020;Altera a Lei nº 12.764, de 27 de dezembro de 2012, que institui a Política Nacional de Proteção dos Direitos da Pessoa com Transtorno do Espectro Autista, para especificar a terapia nutricional.;http://www.camara.gov.br/proposicoesWeb/prop_mostrarintegra?codteor=1925425;;
491620;https://dadosabertos.camara.leg.br/api/v2/proposicoes/491620;PL;312;2011;Altera o art. 8º da Lei nº 9.250, de 26 de dezembro de 1995, para incluir as  despesas com aparelhos de audição entre as deduções permitidas para efeito da apuração da base de cálculo do Imposto de Renda das Pessoas Físicas.;http://www.camara.gov.br/proposicoesWeb/prop_mostrarintegra?codteor=838540;;
2168438;https://dadosabertos.camara.leg.br/api/v2/proposicoes/2168438;PL;9626;2018;Altera os artigos 323, 324, 325, 326 e 327 e acrescenta o artigo 356-A à Lei n.º 4.737, de 15 de julho de 1965 - Código Eleitoral, bem como altera os §§ 1.º e 2.º do artigo 57-H da Lei n.º 9.504, de 30 de setembro de 1997 - Lei das Eleições e acrescenta § 3.º ao mesmo dispositivo legal, para agravar as penas dos crimes eleitorais praticados por meio de veículos de comunicação.;http://www.camara.gov.br/proposicoesWeb/prop_mostrarintegra?codteor=1641600;;
339981;https://dadosabertos.camara.leg.br/api/v2/proposicoes/339981;PL;20;2007;Dispõe sobre o parcelamento do solo para fins urbanos e sobre a regularização fundiária sustentável de áreas urbanas, e dá outras providências.;http://www.camara.gov.br/proposicoesWeb/prop_mostrarintegra?codteor=433737;;
2190763;https://dadosabertos.camara.leg.br/api/v2/proposicoes/2190763;PL;241;2019;Altera o Decreto-Lei n. 2.848, de 7 de dezembro de 1940 - Código Penal, para tipificar o crime de criação e propagação de notícia inverídica.;http://www.camara.gov.br/proposicoesWeb/prop_mostrarintegra?codteor=1707048;;
2288847;https://dadosabertos.camara.leg.br/api/v2/proposicoes/2288847;PL;2390;2021;Acrescenta-se o inc. XIV ao art. 7 e §§1º, 2º e 3º ao art. 20 da Lei nº 12.965, de 23 de abril de 2014 – Marco Civil da Internet, que “garante o direito de atualização de conteúdo e informações ao usuário por provedores de aplicações de internet”.;http://www.camara.gov.br/proposicoesWeb/prop_mostrarintegra?codteor=2036493;;
619203;https://dadosabertos.camara.leg.br/api/v2/proposicoes/619203;PL;7742;2014;Altera a Lei nº 10.671, de 15 de maio de 2003, que dispõe sobre o Estatuto de Defesa do Torcedor, para incluir novas medidas relativas à venda de ingressos.;http://www.camara.gov.br/proposicoesWeb/prop_mostrarintegra?codteor=1262746;;
2279251;https://dadosabertos.camara.leg.br/api/v2/proposicoes/2279251;PL;1532;2021;Altera a Lei nº 9.472, de 16 de julho de 1997, para estabelecer critérios para a revenda de veículos automotores adquiridos por venda direta.;http://www.camara.gov.br/proposicoesWeb/prop_mostrarintegra?codteor=1998245;;
2167137;https://dadosabertos.camara.leg.br/api/v2/proposicoes/2167137;PLP;466;2017;Altera a Lei Complementar nº 90, de 1º de outubro de 1997, para determinar que bases militares estrangeiras só possam ser instaladas permanentemente em território nacional mediante plebiscito, nos termos que discrimina.;http://www.camara.gov.br/proposicoesWeb/prop_mostrarintegra?codteor=1635165;;
2242694;https://dadosabertos.camara.leg.br/api/v2/proposicoes/2242694;PL;1416;2020;Tipifica como crime de responsabilidade a disseminação ou compartilhamento por ocupante de cargo, função ou emprego público de informação falsa, sem fundamento ou difamatória.;http://www.camara.gov.br/proposicoesWeb/prop_mostrarintegra?codteor=1872505;;
2253806;https://dadosabertos.camara.leg.br/api/v2/proposicoes/2253806;PL;2926;2020;Determina que abrigos de proteção animal não poderão ter a prestação dos serviços públicos de energia elétrica, gás, saneamento básico e telecomunicações interrompida durante a pandemia de COVID-19.;http://www.camara.gov.br/proposicoesWeb/prop_mostrarintegra?codteor=1897971;;
498722;https://dadosabertos.camara.leg.br/api/v2/proposicoes/498722;PL;1104;2011;"Altera a Lei nº 9.394, de 20 de dezembro de 1996, que ""estabelece as diretrizes e bases da educação nacional"".";http://www.camara.gov.br/proposicoesWeb/prop_mostrarintegra?codteor=860561;;
2289346;https://dadosabertos.camara.leg.br/api/v2/proposicoes/2289346;SBT;1;0;"NA";http://www.camara.gov.br/proposicoesWeb/prop_mostrarintegra?codteor=2038006;;
298823;https://dadosabertos.camara.leg.br/api/v2/proposicoes/298823;PL;5841;2005;Estabelece a obrigatoriedade da publicação da programação das emissoras de televisão do Poder Legislativo Federal nos jornais de circulação diária.;http://www.camara.gov.br/proposicoesWeb/prop_mostrarintegra?codteor=337250;;
2274573;https://dadosabertos.camara.leg.br/api/v2/proposicoes/2274573;PL;1001;2021;Altera a Lei nº 1.079, de 1950 – Lei dos Crimes de Responsabilidade, para incluir crimes contra a Saúde Pública como Crime de Responsabilidade e dá outras providências.;http://www.camara.gov.br/proposicoesWeb/prop_mostrarintegra?codteor=1978454;;
595991;https://dadosabertos.camara.leg.br/api/v2/proposicoes/595991;PL;6550;2013;Institui o Programa Creche para Todos, autorizando os governos dos Estados, Municípios e Distrito Federal a firmarem convênios com instituições privadas de atendimento a crianças de 0 a 3 anos, para aquisição de vagas, objetivando o atendimento aos excedentes da rede pública, e dá outras providências.;http://www.camara.gov.br/proposicoesWeb/prop_mostrarintegra?codteor=1155382;;
2090560;https://dadosabertos.camara.leg.br/api/v2/proposicoes/2090560;EMR;1;0;Altera a Lei nº 8.078, de 11 de setembro de 1990, para obrigar os fornecedores a informar o histórico de preços dos produtos e serviços ofertados em promoção.;http://www.camara.gov.br/proposicoesWeb/prop_mostrarintegra?codteor=1474763;;
2253576;https://dadosabertos.camara.leg.br/api/v2/proposicoes/2253576;PL;2844;2020;Determina a aplicação de multas, suspensão de isenções fiscais e financiamentos por bancos públicos, além da proibição de contratação pelo Poder Público de pessoas jurídicas que propagam, estimulam ou anunciam, direta ou indiretamente, notícias falsas (Fake News) em veículos de comunicação.;http://www.camara.gov.br/proposicoesWeb/prop_mostrarintegra?codteor=1896983;;
2290388;https://dadosabertos.camara.leg.br/api/v2/proposicoes/2290388;PL;2507;2021;Dispõe sobre a criação, o manejo e a exposição de aves domésticas de combate.;http://www.camara.gov.br/proposicoesWeb/prop_mostrarintegra?codteor=2042621;;
2263229;https://dadosabertos.camara.leg.br/api/v2/proposicoes/2263229;PDL;406;2020;Susta atos de efeitos executivos, oriundos do Poder Judiciário, que exorbitam o poder regulamentar, na forma do art. 49, V da Constituição Federal;http://www.camara.gov.br/proposicoesWeb/prop_mostrarintegra?codteor=1931728;;
2184846;https://dadosabertos.camara.leg.br/api/v2/proposicoes/2184846;PL;10915;2018;Altera a Lei n° 4.737, de 15 de julho de 1965 (Código Eleitoral) para tipificar a divulgação por candidato de fatos sabidamente inverídicos (Fake News) no ano eleitoral e dá outras providências.;http://www.camara.gov.br/proposicoesWeb/prop_mostrarintegra?codteor=1688906;;
2174199;https://dadosabertos.camara.leg.br/api/v2/proposicoes/2174199;PL;10178;2018;Insere parágrafo único no art. 338 da Lei 9.503, de 23 de setembro de 1997, que institui o Código de Trânsito Brasileiro, para obrigar a informação correta sobre volume de combustível no manual do veículo.;http://www.camara.gov.br/proposicoesWeb/prop_mostrarintegra?codteor=1657624;;
611086;https://dadosabertos.camara.leg.br/api/v2/proposicoes/611086;PL;7349;2014;"Acrescenta artigo à Lei nº 8.213, de 24 de julho de 1991, que ""Dispõe sobre os Planos de Benefício da Previdência Social e dá outras providências"", a fim de garantir o emprego do trabalhador com tuberculose desde o diagnóstico da doença até a sua cura.";http://www.camara.gov.br/proposicoesWeb/prop_mostrarintegra?codteor=1241409;;
2292317;https://dadosabertos.camara.leg.br/api/v2/proposicoes/2292317;PL;2696;2021;Altera a Lei nº 8.212, de 24 de julho de 1991, para suprimir a obrigatoriedade do Beneficiário de comprovação de vida junto ao INSS.;http://www.camara.gov.br/proposicoesWeb/prop_mostrarintegra?codteor=2050696;;
2266301;https://dadosabertos.camara.leg.br/api/v2/proposicoes/2266301;PL;5424;2020;Altera a Lei n. 9.504, de 30 de setembro de 1997, para tratar da divulgação de pesquisas eleitorais.;http://www.camara.gov.br/proposicoesWeb/prop_mostrarintegra?codteor=1947902;;
2258016;https://dadosabertos.camara.leg.br/api/v2/proposicoes/2258016;PL;3873;2020;"Institui o prêmio ""Mérito Carlos Chagas"", de âmbito nacional, aos brasileiros pesquisadores, cientistas ou equivalentes e às instituições públicas brasileiras que desenvolverem ou participarem diretamente no desenvolvimento da primeira vacina ou medicamento que seja efetiva para a terapêutica do tratamento da COVID-19.";http://www.camara.gov.br/proposicoesWeb/prop_mostrarintegra?codteor=1914606;;
486344;https://dadosabertos.camara.leg.br/api/v2/proposicoes/486344;PL;7884;2010;Dispõe sobre a divulgação visual obrigatória nas academias de ginástica, centros ou clubes esportivos e outros estabelecimentos congêneres, sobre o uso inadequado de anabolizantes, e dá outras providências.;http://www.camara.gov.br/proposicoesWeb/prop_mostrarintegra?codteor=816638;;
2284941;https://dadosabertos.camara.leg.br/api/v2/proposicoes/2284941;EMR;1;0;Altera a Lei n. 4.117, de 27 de agosto de 1962, para dispor sobre a transferência, comercialização e cessão do tempo de programação para a produção independente.;http://www.camara.gov.br/proposicoesWeb/prop_mostrarintegra?codteor=2019463;;
2259207;https://dadosabertos.camara.leg.br/api/v2/proposicoes/2259207;PL;4046;2020;Altera o Decreto-Lei nº 2.848, de 7 de dezembro de 1940 (Código Penal) para acrescentar meio de comunicação de massa ou sistema de informática ou telemática para causar dano à honra ou imagem como agravante de pena.;http://www.camara.gov.br/proposicoesWeb/prop_mostrarintegra?codteor=1918648;;
2190206;https://dadosabertos.camara.leg.br/api/v2/proposicoes/2190206;SBT;6;0;Dispõe sobre as normas gerais relativas a concursos públicos.;http://www.camara.gov.br/proposicoesWeb/prop_mostrarintegra?codteor=1703242;;
2265937;https://dadosabertos.camara.leg.br/api/v2/proposicoes/2265937;PL;5347;2020;Cria a Lei de Enfrentamento à Desinformação nas Eleições.;http://www.camara.gov.br/proposicoesWeb/prop_mostrarintegra?codteor=1945976;;
2190522;https://dadosabertos.camara.leg.br/api/v2/proposicoes/2190522;PL;80;2019;Define os crimes de abuso de autoridade, revoga a Lei nº 4.898, de 9 de dezembro de 1965, e dispositivos do Código Penal.;http://www.camara.gov.br/proposicoesWeb/prop_mostrarintegra?codteor=1707399;;
2308325;https://dadosabertos.camara.leg.br/api/v2/proposicoes/2308325;PL;4134;2021;Acrescenta o art.287-A ao Decreto-Lei nº 2.848, de 7 de dezembro de 1940 – Código Penal, para tipificar o crime de divulgação de notícia falsa.;http://www.camara.gov.br/proposicoesWeb/prop_mostrarintegra?codteor=2109923;;
2273931;https://dadosabertos.camara.leg.br/api/v2/proposicoes/2273931;PL;912;2021;Altera o art. 26 da Lei nº 9.394, de 20 de dezembro de 1996 (Lei de Diretrizes e Bases da Educação Nacional);http://www.camara.gov.br/proposicoesWeb/prop_mostrarintegra?codteor=1975429;;
2156331;https://dadosabertos.camara.leg.br/api/v2/proposicoes/2156331;PL;8843;2017;"Dispõe sobre o processo administrativo sancionador na esfera de atuação do Banco Central do Brasil e da Comissão de Valores Mobiliários, altera a Lei nº 4.131, de 3 de setembro de 1962, a Lei nº 4.380, de 21 de agosto de 1964, a Lei nº 4.728, de 14 de julho de 1965, a Lei nº 4.829, de 5 de novembro de 1965, a Lei nº 6.024, de 13 de março de 1974, a Lei nº 6.385, de 7 de dezembro de 1976, a Lei nº 7.492, de 16 de junho de 1986, a Lei nº 9.069, de 29 de junho de 1995, a Lei nº 9.613, de 3 de março de 1998, a Lei nº 9.873, de 23 de novembro de 1999, a Lei nº 10.214, de 27 de março de 2001, a Lei nº 11.371, de 28 de novembro de 2006, a Lei nº 11.795, de 8 de outubro de 2008, a Lei nº 12.810, de 15 de maio de 2013,  a Lei nº 12.865, de 9 de outubro de 2013, o Decreto nº 23.258, de 19 de outubro de 1933, o Decreto-Lei nº 9.025, de 27  de  fevereiro  de  1946,  o  Decreto-Lei  nº  70,  de  21  de novembro de 1966 e a Medida Provisória nº 2.224, de 4 de setembro de 2001, e dá outras providências.

NOVA EMENTA: Dispõe sobre o processo administrativo sancionador na esfera de atuação do Banco Central do Brasil e da Comissão de Valores Mobiliários; altera as Leis nºs 6.385, de 7 de dezembro de 1976, 4.131, de 3 de setembro de 1962, 4.829, de 5 de novembro de 1965, 6.024, de 13 de março de 1974, 7.492, de 16 de junho de 1986, 9.069, de 29 de junho de 1995, 9.613, de 3 de março de 1998, 10.214, de 27 de março de 2001, 11.371, de 28 de novembro de 2006, 11.795, de 8 de outubro de 2008, 12.810, de 15 de maio de 2013, 12.865, de 9 de outubro de 2013, e 4.595, de 31 de dezembro de  1964, o Decreto nº 23.258, de 19 de outubro de 1933, o Decreto-Lei nº 9.025, de 27 de fevereiro de 1946, e a Medida Provisória nº 2.224, de 4 de setembro de 2001; revoga o Decreto-Lei nº 448, de 3 de fevereiro de 1969, e dispositivos das Leis nºs 9.447, de 14 de março de 1997, 4.380, de 21 de agosto de 1964, 4.728, de 14 de julho de 1965, e 9.873, de 23 de novembro de 1999; e dá outras providências.";http://www.camara.gov.br/proposicoesWeb/prop_mostrarintegra?codteor=1609736;;
1531554;https://dadosabertos.camara.leg.br/api/v2/proposicoes/1531554;SBT;1;0;"NA";http://www.camara.gov.br/proposicoesWeb/prop_mostrarintegra?codteor=1353862;;
485567;https://dadosabertos.camara.leg.br/api/v2/proposicoes/485567;SBT;1;0;Obriga a veiculação de publicidade de saúde pública pelas empresas de transportes coletivos urbanos.;http://www.camara.gov.br/proposicoesWeb/prop_mostrarintegra?codteor=813012;;
2157986;https://dadosabertos.camara.leg.br/api/v2/proposicoes/2157986;PL;8909;2017;"Altera a Lei nº 12.288, de 20 de junho de 2010, que ""institui o Estatuto da Igualdade Racial"", para estabelecer regras para assegurar a inclusão da população negra nos concursos públicos da administração pública direta e indireta de qualquer dos Poderes da União, dos Estados, do Distrito Federal e dos Municípios.";http://www.camara.gov.br/proposicoesWeb/prop_mostrarintegra?codteor=1612497;;
2299965;https://dadosabertos.camara.leg.br/api/v2/proposicoes/2299965;RDF;1;0;Dispõe sobre as normas eleitorais e as normas processuais eleitorais brasileiras.;http://www.camara.gov.br/proposicoesWeb/prop_mostrarintegra?codteor=2078268;;
2191130;https://dadosabertos.camara.leg.br/api/v2/proposicoes/2191130;PDL;12;2019;Susta os efeitos do Decreto nº 9.690, de 23 de janeiro de 2019, que altera o Decreto nº 7.724, de 16 de maio de 2012, que regulamenta a Lei nº 12.527, de 18 de novembro de 2011 - Lei de Acesso à Informação.;http://www.camara.gov.br/proposicoesWeb/prop_mostrarintegra?codteor=1707710;;
1279356;https://dadosabertos.camara.leg.br/api/v2/proposicoes/1279356;PL;1579;2015;Regulamenta o artigo 239, §4º da Constituição Federal de 1988, ao criar critério suplementar de financiamento do seguro-desemprego a partir da cobrança de percentual adicional sobre alíquota de contribuição para o Programa de Integração Social (PIS), criado pela Lei Complementar nº 7, de 7 de setembro de 1970, e para o Programa de Formação do Patrimônio do Servidor Público (PASEP), criado pela Lei Complementar nº 8, de 3 de dezembro de 1970, dos sujeitos passivos cujos índices de rotatividade da força de trabalho supere o índice médio da rotatividade do respectivo setor econômico na Unidade da Federação.;http://www.camara.gov.br/proposicoesWeb/prop_mostrarintegra?codteor=1336072;;
